Approach Platform,Lead Institution Company,Timeline To Clinic,Timeline Score,Scalability Assessment,Scalability Score,Ip Position,Ip Score,Overall Investment Score,Key Risks,Investment Recommendation
"Cell Suspension Injection Approaches (hRPC/RPC; intravitreal/subretinal) — jCyte, ReNeuron",jCyte (CIRM-funded Phase 2 sponsor) and ReNeuron,Clinical: completed Phase 1/2a safety study in RP (NCT02320812) and Phase 2 activity supported by CIRM funding (jCyte).,7 (analyst-derived; not mentioned in source(s)).,Relatively higher manufacturability vs. sheets: dose-controlled cell suspension and less complex administration (intravitreal injection described).,7 (analyst-derived; not mentioned in source(s)).,Corporate IP expected for jCyte/ReNeuron; specific patents not mentioned in source(s).,5 (analyst-derived; not mentioned in source(s)).,6.6 (analyst-derived weighted composite; not mentioned in source(s)).,Efficacy uncertainty in advanced degeneration populations: sources note there is no definitive evidence these technologies will robustly work for blind patients with severe retinal degeneration; plus competitive and reimbursement risks.,"Buy/Watch: nearer-term clinical readouts and clearer translational pathway (Phase 1/2a completed; Phase 2 supported), but efficacy risk remains."
"RPE Cell Implants on Scaffolds (e.g., OpRegen/BioTime; CPCB-style scaffolded implants)",BioTime/Cell Cure (OpRegen program referenced) plus CPCB consortium efforts,Clinical: safety/efficacy Phase I/II trial in dry AMD referenced (NCT02286089).,7 (analyst-derived; not mentioned in source(s)).,"Moderate-to-good: scaffold fabrication plus standardized cell banking is conceptually scalable, but requires GMP production and specialized surgical implantation; post-market reimbursement mechanisms are highlighted as a challenge.",6 (analyst-derived; not mentioned in source(s)).,Likely mixed corporate + institutional IP; specific patents not mentioned in source(s).,5 (analyst-derived; not mentioned in source(s)).,6.1 (analyst-derived weighted composite; not mentioned in source(s)).,Commercialization risk includes reimbursement: post-market problems include finding the right reimbursement mechanisms; additionally must demonstrate durable functional benefit beyond anatomical engraftment.,Buy/Watch: closest-to-market among the hybrid/regenerative set (active clinical program) but reimbursement and durable outcomes will determine commercial viability.
Retinal Organoid Sheet Transplantation (allogeneic iPSC-derived retinal organoid sheets),RIKEN / Kyoto University / Kobe City Eye Hospital (trial jRCTa050200027; ethics approval noted),Early human clinical feasibility: allogeneic iPSC-derived retinal organoid sheet transplantation performed in two advanced RP subjects (jRCTa050200027) with grafts surviving stably for 2 years.,6 (analyst-derived; not mentioned in source(s)).,"Scalability constrained by iPSC/organoid GMP and reproducibility, but iPSC banking strategies (RIKEN) and improved organoid derivation efficiency may support scale-up pathways.",5 (analyst-derived; not mentioned in source(s)).,Institutional IP likely around iPSC banking and organoid methods; specific patent numbers not mentioned in source(s).,4 (analyst-derived; not mentioned in source(s)).,5.1 (analyst-derived weighted composite; not mentioned in source(s)).,"Key biological risk flagged for retinal sheet grafts: grafts can form rosettes in the host retina, potentially limiting functional integration; additional tumorigenicity/immune risks are inherent but not detailed in provided quotes.",Watch/Moderate: most advanced among organoid-style hybrids (human feasibility; 2-year graft survival) but manufacturing and integration risks remain substantial.
hESC-RPE Monolayer on Parylene C Scaffold (CPCB-RPE1; mesh-supported submicron parylene membrane),California Project to Cure Blindness (CPCB) consortium (USC/Keck-associated program referenced),Preclinical large-animal implantation: CPCB-RPE1 implants were reliably placed in the minipig subretinal space; hESC-RPE monolayers survived as an intact monolayer for ~1 month (human trial status not mentioned in source(s)).,4 (analyst-derived; not mentioned in source(s)).,Feasible but non-trivial: requires parylene scaffold manufacture and GMP hESC-RPE monolayer production/expansion (cells seeded at 10^5 cells/cm^2 and grown ~4 weeks to confluence).,5 (analyst-derived; not mentioned in source(s)).,Consortium/institutional IP likely; specific patents not mentioned in source(s).,4 (analyst-derived; not mentioned in source(s)).,4.6 (analyst-derived weighted composite; not mentioned in source(s)).,Material risk highlighted for parylene scaffold: nondegradability and unknown long-term effects are cited as disadvantages; plus long-term immune/functional benefit not established in provided quotes.,Watch/Hold: good translational engineering (reliable placement; defined scaffold) but long-term safety/benefit and reimbursement pathway must be demonstrated.
Living Electrodes / Biohybrid Neural Constructs (template-stripped MEA + neural tissue; ETH Zurich-funded platform work),ETH Zurich / Swiss National Science Foundation–funded research team (UPenn/Cullen lab mentioned in upstream analysis but not supported by quotes provided).,Preclinical: reported viability and neuronal function for up to 22 days; early in vivo durability concerns (axon degradation ~4 days after implantation in cited work).,3 (analyst-derived; not mentioned in source(s)).,"Early-stage manufacturability: fabrication described as a “simple process flow” with reusable template, but yield of working electrodes per device needs improvement—suggesting scale-up risk.",3 (analyst-derived; not mentioned in source(s)).,Academic IP likely; patents/spinouts not mentioned in source(s).,3 (analyst-derived; not mentioned in source(s)).,3.2 (analyst-derived weighted composite; not mentioned in source(s)).,"Short in vivo durability signal: axons started to degrade ~4 days after implantation (autofluorescence increase), plus device yield issues (working electrodes).",Watch: platform-science potential but durability + manufacturing yield are gating items before credible clinical translation.
Hybrid Retinal Implant — Neuron–Electrode Coupling Micro-well MEA (Bar-Ilan University; Mandel/Farah et al.),Bar-Ilan University (Yossi Mandel lab; ERC Starter Grant support referenced).,Preclinical: subretinal implantation in rats with retinal degeneration reported precursor survival for >1 month with axonal elongation; stimulation threshold reductions to picocoulomb range described; no IND/clinical trial mentioned.,3 (analyst-derived; not mentioned in source(s)).,"High complexity: high-density MEA reported with 3,172 micro-well electrode complexes and 10 µm pixel size; requires tight neuron–electrode coupling and GMP-scale cell production + microfabrication.",3 (analyst-derived; not mentioned in source(s)).,Academic IP expected; patent details not mentioned in source(s).,2 (analyst-derived; not mentioned in source(s)).,3.1 (analyst-derived weighted composite; not mentioned in source(s)).,Translation requires patterned electrical activation and energy transfer for high-density sites; plus combined device+cell (hybrid) development challenges are explicitly noted as design/solution challenges in the source materials.,Watch: compelling concept (cell-sized pixel pitch; low thresholds) but high regulatory/biomanufacturing complexity and early stage warrant grants/strategic partnerships over large VC deployment now.
Biohybrid Living-Wire Implant (MEMS + cultured neurons with axons guided by peripheral nerve graft),Tohru Yagi research group (Japan) — long-running biohybrid retinal implant program (since mid-1990s).,Very early/preclinical: limited neuron regeneration reported (few percent of population) and major unsolved requirement of forming functional connections between electrodes↔cultured neurons and cultured neurons↔CNS neurons.,1 (analyst-derived; not mentioned in source(s)).,"Very low near-term scalability: multi-component approach explicitly involves neurons attached to MEMS and axons guided with peripheral nerve grafts, implying high surgical and manufacturing complexity.",1 (analyst-derived; not mentioned in source(s)).,Academic IP possible; patent details not mentioned in source(s).,2 (analyst-derived; not mentioned in source(s)).,1.4 (analyst-derived weighted composite; not mentioned in source(s)).,"Core scientific risk is achieving functional connectivity across multiple interfaces (electrodes↔cultured neurons↔CNS neurons), in addition to low regeneration rates reported.","Avoid (for purely financial investors): foundational biology and connectivity hurdles remain, implying very long timelines and uncertain translational path."