Company Name,Headquarters,Technology Type,Target Waste Streams,Claimed Performance,Commercial Status,Key Customers Partners,Funding Investors,Recent Milestones
HyProMag,Not mentioned in source.,"Chemical/hydrometallurgical-physical recycling using Hydrogen Processing of Magnet Scrap (HPMS), a hydrogen decrepitation-based magnet recycling process that produces recycled alloy powder suitable for reprocessing","Magnet-containing components (motors, rotors, electronic components), magnet scrap and whole components","Recovers over 400 kg of rare earth alloy per batch; production capacity 100 tonnes/year on single shift, scalable to >300 tonnes/year at full capacity; produces recycled NdFeB magnet blocks/ alloy powder",Commercial; facility opened 15 January at Tyseley Energy Park producing commercial magnets and alloy powders; operational manufacturing facility,GKN and Toyota (validation/partners/customers),Not mentioned in source.,Opened commercial facility at Tyseley Energy Park on 15 January 2026; commissioned HPMS process with capacity up to 300 tpa; validation/partnerships with GKN and Toyota
HyProMag Ltd,Not mentioned in source.,Chemical/physical hydrogen processing (HPMS) that demagnetises and breaks apart NdFeB magnets for mechanical separation of coatings and recovery of NdFeB powder,"End-of-life electronic devices (e.g., computer hard drives), wind turbine magnets, motors from electric vehicles and other EoL products containing NdFeB magnets","Claims to produce demagnetised NdFeB powder of sufficiently high purity for re-processing into new magnets or rare earth alloys and describes the method as ""extremely efficient"" with a low environmental footprint",Not mentioned in source.,Not mentioned in source.,Not mentioned in source.,Not mentioned in source.
HyProMag USA,UK (existing pilot facility referenced) and planning a USA Texas hub (Dallas	Fort Worth area),Chemical / physical magnet recycling and manufacturing processes: advanced grain boundary diffusion (GBD) and Hydrogen Processing of Magnet Scrap (HPMS) for recycling and magnet production,NdFeB magnet scrap and sintered NdFeB magnets (magnet manufacturing and scrap),"Tripled pilot throughput; >50 HPMS runs producing ~900 kg recycled NdFeB alloy powder at Tyseley Energy Park; projected Texas Hub annual output: 750 t recycled sintered NdFeB magnets + 807 t NdFeB co-products (total payable 1,557 t)","Pilot (UK facility operational) and development stage for US commercial hub (EPCM design 25% complete, permitting expected Q3 2025)",Partners and stakeholders include Mkango Resources and engineering advisors PegasusTSI and BBA; CoTec referenced via Julian Treger's comment (partner/stakeholder relationships),"Seeking funding from U.S. Government, commercial lenders, equity providers and offtakers; no specific investors named in source",2025 milestones: EPCM design 25% complete; UK pilot throughput tripled; >50 HPMS runs producing ~900 kg NdFeB powder; shortlisted 4 Texas hub locations; feasibility study expanded to include Texas Hub and two pre-processing facilities; announced expansion to include three HPMS vessels and concept studies for long-loop recycling
"HyProMag USA, LLC","Dallas-Fort Worth, Texas, USA","Chemical/pyrometallurgical-hydrogen-based mechanical recycling: Hydrogen Processing of Magnet Scrap (HPMS) for magnet-to-magnet recycling; modular, low-carbon platform","End-of-life EV motors, data-center and server equipment, industrial equipment, consumer electronics, and manufacturing scrap",Facility recover >400 kg rare-earth alloy per batch; production capacity 100 tpa (single shift) to >300 tpa (multiple shifts); energy use 88% less and CO2 emissions 85% lower vs conventional methods; target 10% US domestic magnet supply within five years,Commercial: UK Facility operational/commercial at Tyseley Energy Park; HyProMag operating facility as industrial partner; HyProMag USA in expansion/pilot-to-commercial scale with announced expansions in SC and NV and planning Texas hub,University of Birmingham / Magnetic Materials Group (developer); U.S. Department of State (Minerals Security Partnership); engaging with hyperscale data-center and infrastructure operators (unnamed),Investors/owners: CoTec Holdings Corp. and HyProMag Limited (50:50 ownership of HyProMag USA); HyProMag Limited owned via Maginito Ltd (majority Mkango Resources and CoTec); Mkango invested since 2020; support from Innovate UK,Opened UK facility at Tyseley Energy Park (Jan 2026); announced expansions in South Carolina and Nevada; executed site lease at Ironhead Commerce Center (Texas); ongoing engineering/feasibility for Texas Hub; pursuing U.S. public listing
"HyProMag USA, LLC","Dallas–Fort Worth, Texas (project site)",Chemical/mechanical recycling using patented Hydrogen Processing of Magnet Scrap (HPMS) technology (patent licensed from University of Birmingham) — process for recovering and remanufacturing rare-earth permanent magnets,End-of-life magnet-bearing materials from electronics and other magnet-containing products (magnet scrap),"Expected annual production: 750 tpa recycled sintered NdFeB magnets; 807 tpa associated NdFeB co-products; total payable capacity 1,557 tpa within five years of commissioning",Pre-commercial: project in lease/facility development stage targeting commissioning mid-2027; includes planned pre-processing facilities in Nevada and South Carolina; modular hub-and-spoke design,"Key partners: Intelligent Lifecycle Solutions (feedstock supplier); corporate ownership and partners include HyProMag Limited, Maginito Limited, Mkango Resources Ltd., and CoTec Holdings Corp.","Owned 50:50 by CoTec Holdings Corp. and HyProMag Limited (corporate funding structure). Specific investors, VC funding, or grants: Not mentioned in source.",Finalized long-term lease for Dallas–Fort Worth facility (Dec 2025); expanded detailed engineering to include three HPMS vessels (Mar 2025); ILS commenced feedstock stockpiling (Aug 2025). Other milestones: product carbon footprint study (Mar 2025) and commissioning concept studies for expansion and long-loop recycling (2025) — referenced but details in other releases.
Paladin EnviroTech (REcapture joint venture with Critical Materials Recycling),"Tampa, Florida (Paladin corporate HQ) with REcapture processing facility in Fairfield, Ohio; additional facilities in Tampa (FL), St. Cloud (MN), Boone (IA)",Chemical/hydrometallurgical processing (specialized processing to separate REEs from components; described as metallurgical processing rather than biological),"End-of-life equipment and components containing NdFeB magnets: wind turbine generators, EV motors/drive systems, hard drives and electronic equipment, industrial machinery (motors/generators)",Not mentioned in source.,"Pilot/commercial: operational collection and preprocessing centers (Tampa, St. Cloud, Boone) with a processing facility in Fairfield, Ohio; joint venture launched and appears operational for processing and services",Critical Materials Recycling (JV partner); Daeheung M&T (market/access partner); Fortune 500 clients through Paladin's ITAD relationships,Not mentioned in source.,"Launch of REcapture JV with Critical Materials Recycling (Business Wire Oct 27, 2025) and acquisition of R&L Recycling B.V. to establish European platform (press release listed); senior leadership appointments in 2025-2026"
Cyclic Materials,Not mentioned in source.,Chemical/hydrometallurgical recycling processes (industrial recycling of REEs from end-of-life products) — the site describes a recycling process but does not specify biological methods vs specific chemistry,"E-scrap, magnetic waste (magnet manufacturers), drive motors and hybrid transmissions, robotics and drones components, medical devices (MRI), hard disk drives, wind turbine generators",Claims reduced CO2 emissions by 61.2% and reduced water usage by 95% compared to mined resources,"Scaling to commercial: announced investments and facility plans in 2025-2026 (new US campus, Centre of Excellence in Kingston, first commercial US facility) and partnerships for magnet manufacturing waste recycling — indicates pilot->commercial scale expansion","Partners/investors/customers mentioned include BMW, Microsoft, Glencore (multi-year agreement for recycled copper), VACUUMSCHMELZE (partnership to recycle magnet manufacturing waste), Lime (partnership for electric motors), InMotion Ventures (investor)","Funding rounds include Series B (USD $53M) and Series C (USD $75M) announced; notable investors/partners listed include Amazon, T. Rowe Price, BMW i Ventures, Energy Impact Partners, Hitachi Ventures, Fifth Wall, BDC, Climate Pledge Fund, InMotion Ventures, Glencore partnership","Key milestones 2024-2026: multi-year Glencore recycled copper agreement (12/11/2024), Series B funding extension (12/11/2024), Series B $53M (09/25/2024), investment and Centre of Excellence in Kingston (06/11/2025), US commercial facility investment (04/23/2025), Series C $75M (11/03/2025), New South Carolina campus expansion (01/23/2026)"
Cyclic Materials,Not mentioned in source.,"Chemical/hydrometallurgical recycling and refining of REEs from end-of-life products (process description: extracting and refining rare earth elements from e-scrap, magnetic waste, and industrial components)","E-scrap, magnetic waste, and industrial components",Not mentioned in source.,Active commercial-facing organization offering partnerships for recycling; specific TRL/plant capacity not mentioned,"Glencore (partner quoted), and memberships/associations including BIR, Fiesta, Suppliers Partnership, Terra, ARA, Creative Destruction Lab, MaRS, OARA, RDRWind, REIA, REMA, SAFE",Not mentioned in source.,Not mentioned in source.
REEcycle HOLDINGS INC,Not mentioned in source.,"Chemical (proprietary solvent-based hydrometallurgical process involving low-pressure, sub-100°C solvent dissolution and crystallization of REEs)","NdFeB magnets from end-of-life sources including wind turbines, electric vehicles and bikes, hard drives, MRI machines, and magnet swarf",99.8% recovery efficiency for REE extraction from scrap using their proprietary solvent,Commercial-facing (sells concentrate to customers); specific facility locations or TRL not mentioned in source.,Not mentioned in source.,Not mentioned in source.,Not mentioned in source.
GEOMEGA Resources,"Boucherville, Quebec, Canada (75 Boul. De Mortagne)",Chemical (hydrometallurgical) processes for critical metal extraction and refining; reagent recycling and integrated hydrometallurgical platform,"End-of-life NdFeB magnets, magnet production scrap/swarf, bauxite residue (red mud), sulfide tailings; industrial and metallurgical residues",">90% recovery and >99% purity for Nd, Pr, Dy, Tb from NdFeB magnets","Developer and licensor of hydrometallurgical processes; commercial licensing model implied, but specific operational facilities not mentioned in source","Collaborates with industrials, refineries and technology partners; specific customers/partners not named besides logos/images implying Canadian/Quebec and Rio Tinto presence but not explicitly detailed in text (logo shown)",Not mentioned in source.,Not mentioned in source.
REEcycle,Not mentioned in source.,Chemical (patented hydrometallurgical-like process extracting REEs as metal organic frameworks; low temperature and solvent-assisted),"Discarded NdFeB magnets from electronics and clean-energy equipment (HDDs, wind turbine motors, EV/bike motors, speakers, MRI machines, satellites, defense systems)",Claims 99.8% recovery efficiency of REEs and final product as metal-organic frameworks,Not explicitly stated; website implies commercial operations/offerings but no explicit TRL or facility details provided in source.,Sells final REE product to OEMs (no named customers/partners disclosed),Not mentioned in source.,Claims to hold a patent on their process; no dated milestones (2022-2026) provided in source.
Okon Recycling,"5901 Botham Jean Blvd, Dallas, TX 75215",Chemical/hydrometallurgical recycling and material reprocessing (magnet-to-magnet short-loop and long-loop conversion to REE oxides/carbonates),"End-of-life magnets, magnet manufacturing waste (e.g., grinding swarf), metal and renewables scrap",Claims energy savings: short-loop magnet-to-magnet process reduces energy use by ~88% vs primary mining; cost claim: recycled REEs up to ~30% lower cost vs traditional extraction,"Commercial operations offering full-service recycling; ISO 9001 & ISO 14001 certified facility in Dallas, TX; operational commercial services (contact for commercial services)",Not mentioned in source.,Not mentioned in source.,"ISO 9001:2015 and ISO 14001:2015 certification noted; site content dated December 7, 2025 and company copyright 2026 (indicating recent activity)"
Heraeus Remloy,"Hanau/Bitterfeld-Wolfen, Germany",Chemical/hydrometallurgical recycling for production of nanocrystalline REE magnetic powders (process described as recycling technology producing NdFeB powders),End-of-life electronic devices and waste magnets from computer hard disks,"Initial capacity 600 tons/year of nanocrystalline REE magnetic powders, rampable to 1,200 tons/year; claims CO2 emissions reduction of 80% vs primary production","Commercial — production started at Bitterfeld plant with processing capacity up to 600 t/year (scalable to 1,200 t/year)",Not mentioned in source.,Not mentioned in source.,"Started production at Bitterfeld Remloy plant (May 2024) with 600 t/year capacity, planned ramp to 1,200 t/year"
Ionic Technologies,Not mentioned in source.,Chemical/hydrometallurgical recycling process producing high-purity rare earth oxides (patented extraction process),End-of-life magnets / magnet recycling (NdFeB magnets),Produce high-purity rare earth oxides (99.9%+),"Implied commercial/piloting activity but specific TRL, facility locations or statements of commercial operation not mentioned in source",Not mentioned in source.,Not mentioned in source.,Not mentioned in source.
REEMAG,"Sydney, Australia (123 Sample St, Sydney NSW 2000)","Chemical-free proprietary magnet recycling process (dry, patented technologies for converting magnet scrap and E-waste back to reusable powder)","Scrap, e-waste, off-cuts, swarf, and end-of-life NdFeB magnets",Claims >80% reuse of raw material; up to 90% reduction in energy consumption and 70% reduction in GHGs compared to primary production,Not explicitly stated; website suggests commercial partnership engagement but does not specify lab/pilot/commercial status or operational facilities.,"Targets magnet manufacturers, corporations, e-waste recyclers, and governments as partners/customers; no named customers listed.",Not mentioned in source.,Not mentioned in source.
GEOMEGA Resources,"Boucherville, Quebec, Canada (75 Boul. De Mortagne)","Chemical hydrometallurgical extraction/refining process (closed-loop chemical disassembly of NdFeB magnets, reagent recycling)","End-of-life NdFeB magnets, production scrap, machining swarf (magnet manufacturing waste)",">90% REE recovery; >99% TREO purity for Nd, Pr, Dy, Tb; ~67% iron purity by-product; ~54% GHG reduction vs conventional routes",Pilot/demo stage: Saint-Hubert demonstration plant under construction processing 1.5 tonnes/day; TRL 7-8,Government funding partners (Federal and Provincial governments provided $8M CAD); pursuing licensing/JV/BOO partnerships with magnet manufacturers,Federal and Provincial government financing ($8M CAD),2022-2026 milestone: Construction of Saint-Hubert demonstration plant (1.5 t/day) and receipt of $8M CAD federal/provincial financing
Heraeus Remloy,Not mentioned in source.,Chemical vs biological not explicitly stated; describes a recycling technology for NdFeB magnets that is chemical-free / environmentally friendly (implying physical/recovery process without chemicals),NdFeB magnet materials / magnet scrap and production waste (recycled magnetic powders from NdFeB),Claims comparable magnetic properties to virgin magnets and 80% less energy consumption and CO2 pollution versus primary production,Commercial; operates Europe's largest recycling plant for NdFeB magnets,Not mentioned in source.,Not mentioned in source.,Operates Europe's largest recycling plant; company publicity including commentary in Nikkei Asia (mentioned in news)
Noveon,"San Marcos, Texas",Chemical/mechanical recycling process for manufacturing NdFeB magnets from recycled material (described as 'M2M' technology),End-of-life rare earth magnetic material (recycled NdFeB magnets),Claims ability to manufacture NdFeB magnets from recycled sources 'even stronger than those they replace',"Commercial production ramp-up at headquarters in San Marcos, Texas (commercial)",Not mentioned in source.,Not mentioned in source.,"Announced CTO-developed M2M recycling technology and stated ramp-up of EcoFlux NdFeB magnet production at San Marcos, Texas (reported September 2023)"
HyProMag Ltd,Owned by Maginito Limited and ultimately Mkango Resources Ltd (UK and Canada listed),Chemical/physical hydrometallurgical/pyro-hydrogen processing (Hydrogen Processing of Magnet Scrap - HPMS) to extract and demagnetise NdFeB alloy powders,NdFeB magnets embedded in scrap and redundant equipment (magnet scrap),Not mentioned in source.,Founded 2018; ownership changed August 2023 to Maginito/Mkango. No explicit TRL or operational facility details mentioned on page,Not mentioned in source.,Owned by Maginito Limited; parent company Mkango Resources Ltd (TSXV/AIM:MKA),Acquisition/ownership transaction completed August 2023 where HyProMag became 100% owned by Maginito Limited
Heraeus Remloy,Not mentioned in source.,"Chemical/hydrometallurgical recycling (magnet recycling and circular economy processes) — Heraeus Remloy describes a ""globally unique technology"" for recycling Nd-Fe-B magnets and closing the recycling loop.","Nd-Fe-B magnets from production scrap, built-in applications, and end-of-life magnets (magnet manufacturing scrap and end-of-life products).",Not mentioned in source.,Operational/commercial initiative aiming to establish circular economy for rare earth magnets; specific TRL or facility details not mentioned in source.,Not mentioned in source.,Not mentioned in source.,"Positioning and public messaging on market outlook through 2026; no specific company milestones (facilities, partnerships) from 2022-2026 mentioned in source."
Mkango Resources Ltd.,"Calgary, Alberta, Canada",Chemical/hydrometallurgical recycling using Hydrogen Processing of Magnet Scrap (HPMS) licensed to HyProMag (industrial partner),End-of-life rare earth permanent magnets (NdFeB) and magnet scrap; short-loop and long-loop recycling routes via Maginito/HyProMag and Mkango Rare Earths UK Ltd respectively,Recover >400 kg rare earth alloy per batch; produce ~100 tpa (single shift) and >300 tpa (multiple shifts) of sintered magnets from recycled alloy,Commercial — Facility at Tyseley Energy Park (UK) officially opened and operated commercially by HyProMag; HyProMag Germany (Pforzheim) under construction; HyProMag USA feasibility and engineering with first production targeted mid-2027,"University of Birmingham MMG (technology developer), HyProMag (industrial licensee/operator), Maginito and CoTec (owners/partners)","Investment by Mkango (majority owner via Maginito), CoTec Holdings as minority owner, and grant/support from Innovate UK; specific funding amounts not mentioned",2026: Official opening of Tyseley Energy Park recycling and magnet manufacturing facility (UK). 2024: HyProMag USA completed feasibility study; detailed engineering underway for Texas Hub with first production targeted mid-2027. Ongoing: Construction of Pforzheim plant in Germany; international roll-out plans
"University of Birmingham (facility), HyProMag (industrial partner / licensee / company), Maginito Ltd / Mkango (owner)","Tyseley Energy Park, Birmingham, UK (University of Birmingham facility). HyProMag / Maginito ownership noted (not full HQ addresses).",Chemical / physical process: Hydrogen Processing of Magnet Scrap (HPMS) — hydrogen-based demagnetisation and extraction process licensed to HyProMag; described as alternative to chemical processes,"Hard drives, electric motors, wind turbines, robotic actuators, pumps, filters, electronics (end-of-life magnet-containing products)",Recover >400 kg rare earth alloy per batch; production capacity ~100 tonnes/year (single shift) and >300 tonnes/year (multiple shifts); ~90% CO2 saving vs primary production,"Commercial facility at Tyseley Energy Park (University-operated, HyProMag as industrial partner); TRL implied commercial; previous proof-of-concept at 50-100 kg batches","Industrial partner: HyProMag; Industry stakeholder/customer: Jaguar Land Rover (JLR) cited as supporter/endorser; funders/partners: Innovate UK, EPSRC, Advanced Propulsion Centre, UKRI/Horizon","Facility funded by Innovate UK (~£4.5M) with supporting grants from Innovate Climates Programme, EPSRC, Advanced Propulsion Centre, EU Horizon; HyProMag ownership: Maginito Ltd (79.4% Mkango, 20.6% CoTec)","Jan 15, 2026: Launch of commercial HPMS facility at Tyseley Energy Park; commercialisation of HPMS technology via HyProMag/Maginito with international roll-out underway (Germany, USA) and prior Mkango investment since 2020"
Carester (Caremag subsidiary),France,Chemical / refining (rare earth recycling and refining via Caremag facility),"Magnet waste (2,000 tonnes/year) and mining concentrates (5,000 tonnes/year)",Expected output: 600 tonnes Dy+Tb oxides and 800 tonnes Nd+Pr oxides annually,Construction/near-commercial; operations scheduled by end of 2026 (Caremag facility),Stellantis (committed customer); Japan backers including JOGMEC and Iwatani as partners/funders,EUR 216 million total funding: EUR 110M from Japanese backers (including JOGMEC and Iwatani) and EUR 106M from French government,2025: Project announced; secured EUR 216M funding; 2026: facility scheduled to start operations by end-2026; Stellantis signed as customer
Heraeus Remloy,"Bitterfeld-Wolfen (near Leipzig), Germany","Chemical/hydrometallurgical recycling technology for NdFeB magnets (process described as ""recycling technology"" producing nanocrystalline rare earth magnetic powders)","End-of-life NdFeB magnets (e.g., from computer hard disks) and production scrap","Claims CO2 reduction of 80% vs primary production and production capacity of 600 tons/year of nanocrystalline rare earth magnetic powders, upgradable to 1200 tons/year","Commercial — production started at a large-scale recycling plant in Bitterfeld-Wolfen, Germany (operational facility)",Seeking suppliers and recycling partners for feedstock; specific customers/partners not named in source,Not mentioned in source.,"Commenced production at a large-scale European recycling plant (Bitterfeld-Wolfen) in 2025 with initial capacity 600 t/yr, scalable to 1200 t/yr"
Heraeus Remloy,"Hanau/Bitterfeld-Wolfen, Germany","Chemical/hydrometallurgical recycling process for NdFeB magnets (described as ""recycling technology"" producing nanocrystalline rare earth magnetic powders)","End-of-life electronic devices (e.g., waste magnets from computer hard disks)","Producing 600 tons/year of nanocrystalline rare earth magnetic powders, rampable to 1,200 tons/year",Commercial production started at Bitterfeld facility (operational plant),Not mentioned in source.,Not mentioned in source.,"Started production at Bitterfeld plant in 2024; initial capacity 600 t/year with ramp to 1,200 t/year"
REE4EU,Not mentioned in source.,Chemical: integrated High Temperature Electrolysis (HTE) and Ionic Liquid Extraction (ILE) for REE recovery and direct production of Rare Earth Alloys,In-process wastes and end-of-life permanent magnets and Ni metal hydride battery waste,Pilot recovery: treated several tons of wastes and recovered almost 100 kg of rare earth alloys,Pilot-scale demonstration operational; industrial-scale ambition stated but commercial facility Not mentioned in source.,"Consortium partners include SINTEF, Tecnalia, LCM (Less Common Metals), VAC (Vacuumschmelze), Elkem, IDENER, Inovertis, CEA, SNAM, STENA, AVERE, PNO Innovation, CEFIC, UPS (Laboratoire de Génie Chimique)",Funded by European Commission Horizon 2020 (Grant Agreement No. 680507),Pilot operation treating several tons and recovering ~100 kg RE alloys; 1kA electrolysis cell trials at LCM validating HTE with SINTEF analysis; Solar Impulse Efficient Solution label awarded (date Not mentioned)
Caremag SAS,"Lacq, south of France",Chemical hydrometallurgical recycling and refining (recycling + refining plant; described as environmentally friendly with energy recycling and lower CO2),End-of-life magnets and mining concentrates (magnet scrap and mining concentrates),"Recycle capacity: 2,000 t/year of magnets; refine capacity: 5,000 t/year of mining concentrates; expected output: 600 t/year Dy+Tb oxides and 800 t/year Nd+Pr oxides",Funded; construction of commercial facility in Lacq underway; operations expected late 2026 (refining activity noted 2027 with JOGMEC involvement),"Partners/investors: JOGMEC (Japan Organization for Metals and Energy Security), Iwatani (major gas company), Japanese investors and French government funding (total €216M)",Total funding secured: €216M (€110M from Japanese investors including JOGMEC/Iwatani; €106M from French government),2025 announcement of €216M funding and planned Lacq facility; construction underway toward operations late 2026; partnership/investment confirmation from JOGMEC/Iwatani with refining to start ~2027
